Soloni 尼泊尔,11360000,1143000,未知,会中文的中国小迷妹商务： 注明来意（非本人）、insta soloni_kumari - weibo 尼泊尔soloni宝宝在尼泊尔有珠宝首饰店从小爱画画拍视频因为开心可以来加德满都找我https://g.page/KTM-mehendi-henna?share
尼泊尔的妮妮,4354000,352000,未知,我是妮妮，目前在尼泊尔～第一次来尼泊尔，不会英语，尼泊尔的妮妮，每天盲盒游尼泊尔！每天定点中国时间：10点直播 海外好物qiongyou4
尼泊尔小哥sandy桑迪,15486000,1092000,未知,传播正能量，热爱中国主张世界和平团结来自喜马拉雅高山国尼泊尔爱好研究中国历史文化喜欢唱中文歌，特别是中国老歌热爱生活 热爱大自然 喜欢简单朴实的生活 宣传中尼友谊
真知见,15542000,1377000,军事专家,以独特的视角，给大家分享我的真知灼见！
雪山王国——尼泊尔,4519000,304000,未知,湖南小伙常驻尼泊尔用视频记录尼泊尔的风土人情合作: neo9813016466
尼泊尔李小龙,2058000,255000,未知,kathmandu Nepal9813558969V-Xiaolong2052来，我们聊聊天。你们都在忙什么呢？
环球网,18,32313000,环球网官方账号,世界那么大，环环带你看天下。官方商务合作或新闻投稿 vx：hqmrrs（请注明来意）
第一军情,63015000,20915000,第一军情官方抖音号,观军事 知天下
《HU. ZM》尼泊尔,1339000,111000,未知,感谢大家关注和支持，跟大家一起走进尼泊尔，欣赏尼泊尔人文地理风俗
尼泊尔金刚菩提70后大叔,419000,185000,未知,感谢抖音绿色平台给大家带来尼泊尔一手金刚菩提谢谢大家的支持
尼泊尔阿肥,704000,118000,未知,肥是一种态度，本人特长：食完就训，训醒就食。带你们吃遍好吃的，喝遍好喝的，玩遍好玩的。哪里有好吃的，哪里就有我。全部私信和评论都会看团购优惠套餐点击视频左下角定位niboerafei
尼泊尔 张欣妍,942000,124000,未知,Life is struggle fight for it.wx:the1slient_river
尼泊尔小俊,2627000,140000,未知,原创视频！每日更新！博您一笑！印度黑暗料理美食家！常驻印度五年有余了解印度拍摄不易！盗版请“吱”一声！唯一本人抖音号！开场白：好嗨吖！奥利给！默默做好自己，在路上力所能及的帮助他人！传递正能量！温暖人心！感恩一路关注支持！
尼泊尔冯掌柜·颂钵,3641000,311000,未知,尼泊尔民宿掌柜，PADi潜水员，滑翔伞飞行员尼泊尔颂钵协会NGBH认证音疗师师从多位尼泊尔名师 Shree和Swami旅居尼泊尔的山东人颂钵培训和请钵需求zhanggui991总有一天你会来到尼泊尔今年计划，珠峰攀登……
尼泊尔乡村生活,142000,150000,未知,尼泊尔山区的农村生活。
尼泊尔安心,85000,152000,未知,分享真实的尼泊尔创业生活
行者合金环球旅行,5201000,924000,未知,作品今日头条首发，搜行者合金环球旅行现在在尼泊尔Vx:guili0022018年4月份安耐不住对远方的向往，开始骑着单车环华骑行，从辽宁丹东出发途径河北-内蒙-山西-陕西-宁夏-甘肃-新疆-西藏-云南-广西-湖南-重庆-成都-拉萨。环华之旅还在路上。因2020在尼泊尔过年，徒步ebc.act.poon2年后重新出发在路上，加油
奇布鲁（在尼泊尔）,3370000,236000,未知,武汉加油，中国加油！
阿鹏环球行,1536000,213000,未知,品世间百态 尝人间冷暖做自己喜欢的事 人生就没有遗憾不出意外的话 每天都会更新视频
神秘的世界,12238000,1200000,神秘的世界官方账号,解民间奇闻轶事，观世间百态万象
海博TV,3,8212000,福建省广播影视集团海博TV客户端官方账号,福建省广播影视集团融媒体资讯中心
红星新闻,14,28004000,《成都商报》官方账号,关注红星新闻，更多暖心画面，更多好听音乐等你来
光明网,1,15661000,光明网,中央重点新闻网站我们是一家有态度的网站
