泰国77Seven,7112000,1627000,未知,粉丝找我 : taiguo-767另外一个号泰国七七 更新些自己的日常还有信仰每晚9点不定时直播在泰7年从事美妆方面 商务合作：W_7777_不会主动去私信人 没有其他账号 大家谨防上当曼谷招助理 白羊 狮子 射手 优先考虑
泰国肥猫,29518000,2514000,未知,周一、三、五晚上国内7点半直播泰国博仁大学旅游专业毕业。：taiguofeimao（产品商务）：17354701101（星图备注来意）中国人旅居曼谷十年，妻子泰国人从事旅游多年，对泰国风土人情了解全面。肥猫不肥，只因妻子喜欢猫感谢大家喜欢，感谢关注！任何私下转款退款的都是骗子，宝宝们谨
泰国阿航,12969000,1289000,未知,皮卡皮卡生活在泰国的阿航探寻泰国隐藏美食揭密地道泰餐做法感受凡人酸甜苦辣：Seanhang(仅商务）**禁止搬运！冒充搬运必究****切勿相信冒充诈骗，作者不接受私下转账**
泰国阿芳夫妇,26233000,1852000,未知,萨瓦迪卡，家族乳胶产品已上商品橱窗，谢谢支持老公是中国人我是泰国龙凤胎妈妈赛莎梦乳胶内衣品牌创始人泰国百年万亩橡胶家族继承人抖音：afang9997粉：saisamorn666商务：nine_BD王牌服饰工厂：kin200160扩坤麻麻卡 (Thank You)
泰国阿浪,36174000,1919000,娱乐视频自媒体,旅居在泰国的毫无斗志的中国养老青年招：编导，助理，学徒，实习生wx:alangtaiguo 同名
泰国壮壮,6358000,951000,未知,夏天太浪漫了 ，我想请它吃顿饭如果你有空，也可以一起来~商务：alangtaiguo
泰国阿申,9055000,910000,未知,定居曼谷生活6年，一个正经又不正经的博主，谢谢喜欢粉丝找我：taishen199436商务合作找我:top457859
MikeAngelo中国,17206000,3884000,泰国歌手、演员、导演,此用户没有填写简介
小老虎的泰国行,32404000,4598000,未知,定居曼谷7年，一个人一张嘴 吃遍泰国领略真实地道的泰国本土吃喝玩乐不入坑 不踩雷 不套路 不乱吹喜欢我VX:emsxiaolaohu007（注明来意）吃货口号:两份是对美食最大的尊重 好吃就说啊蕾玛
泰国Noot,15169000,967000,未知,我是爱吃螺蛳粉的泰国女生小怒学厨师专业的大学生一枚商务合作加微：mcn_8888WB：泰国小怒noot
王仪在泰国,5955000,707000,未知,记录我的养老生活，谢谢朋友们的关注爱吃健康美食，余生努力取悦自己商务合作：Niuniukk9不会以退货联系大家转账！谨防上当！
泰国Super Monkey 酒吧,367000,384000,未知,经历的事情就像看过的每一本书，有的丢弃了，有的珍藏了，有的放回书架了，有的放在枕边。有到泰国的朋友如果愿意可以到我的酒吧歇歇脚，我请您小酌一杯哦，随时欢迎！
泰国琳姐,4848000,408000,未知,定居泰国陪读妈妈一枚记录泰国风情与生活房产 l导游 l探店 l地陪 l留学 l跑庙 l翻译V15033115790(同手机号)有朋自远方来 不亦乐乎
王暖暖,17158000,2646000,中国孕妇泰国坠崖案当事人,没有公司 没有团队 只有你们记录我的第二次生命分享生活的点点滴滴我已经很幸运了，拥有那么多爱，我要把这些分享给所有需要的人.希望尽一己之力，治愈和点亮你的生活商务V：wangnuannuan2019
泰国大表姐,570000,230000,未知,粉丝找我：th338th更新泰国日常生活和信仰居泰12年，爱生活，旅游，摄影佛系开播
永琪在泰国,10669000,624000,未知,泰国居住十年（现居泰南宋卡府合艾市）粉丝找：yongqi5657品尝泰国生活的各种美食分享泰国的风土人情
泰国表哥,8394000,1259000,未知,定居泰国，抖音里最了解泰国的“泰国通”。长期招助理运营客服：q39113
泰国小胖,3668000,639000,未知,泰国吃喝玩乐不吹不黑、真实评价、：douyinxiaopang1
泰国小媳妇,1543000,360000,未知,我是嫁到泰国的泰国小媳妇v：shuling518
泰国七七,2521000,261000,未知,此用户没有填写简介
泰国菜爷,1296000,134000,未知,曾经独自带3000徒步搭车流浪2年定居泰国近10年商务合作981740247
泰国jojo-啾啾,2740000,338000,未知,我是泰国人 谢谢大家关注更多泰国小姐姐在我喜欢，关于泰国都可以问我
泰国阿磊,3910000,548000,未知,Ta正在关注你哦萨瓦迪卡~感谢大家的喜欢与支持每天分享泰国日常美食美景旅居攻略我是在泰国曼谷留学的南京小哥哥一枚联系wx:892125657(请备注来意)
Esther Supreeleela,3433000,431000,泰国演员,泰国演员《命中注定我爱你》《新美人计》 《命中不注定》《一喵定情》
泰国头条新闻,1739000,172000,泰国头条新闻社官方账号,泰国新闻资讯一网打尽专业、实时、客观、公正全网同号：官网、WB、GZ号…
泰国LG,2222000,166000,未知,tiktok:yggg_3 Ins:liuge3
泰国PP姐妹,2223000,180000,未知,我们是泰国双胎宝姐妹 Preem姐姐 Pam妹妹合作联系：mcn_8888（非本人）
泰国赵校长,3432000,567000,未知,在泰国资源最好的90后...…泰语无敌！ 长春出生 5岁移居厦门 初二到泰国 经常出没LA商务合作：dongyuzhao5899 闲来无事就开播哈！爱你们
泰国红姐,3289000,251000,未知,我是中国人定居泰国微胖二宝妈，吃货一起聊聊泰国，淘淘泰国好物交个朋友吧：taiguohongjie1
泰国小龙,13721000,713000,未知,极其热爱冲浪、潜水、健身、摄影、户外记录平淡的东南亚生活
泰国旅游,12000,137000,未知,去泰国浪，最省钱最地道的泰国自由行
泰国JDM改装之旅,6044000,681000,未知,年轻人在泰国机舱净化第一人分享我的JDM改装之旅为支持玩车和创作，商务合作15556926676如果你爱玩改装，想玩但不敢玩改装，先看看我，替你踩踩踩踩坑
泰国周老板,1465000,317000,未知,最了解泰国的泰国老周 泰国的一切v: Mrzhoubkk
Push_dj,5756000,778000,泰国男演员,Hi！我是泰国演员Push，感谢你们的关注！工作人员vx：wzb_521（只对接工作，请备注“Push商务合作”）
@泰国苏宁老师,6457000,564000,未知,泰好学教育是本人工作学校的账号此账号为唯一私人账号 有事可+ V：suninglaoshi55555 s0625153389
泰国妻管严,2645000,487000,未知,扫洼地卡我和我媳妇带着孩子在生活身边有一群沙雕盆友们互相扶持记录着你们意想不到趣闻趣事虽然我泰语不行但是东北话十级请大家多多关注留言互动微信wuyixi2020一定注明来意否则不加
泰国大污,446000,216000,未知,带你看最真实的泰国vx: 1106501675请备注来自抖音～
泰国小舅,2671000,336000,未知,泰国娱乐圈工作，非专业吃货不卖东西不代购，祝您早生贵子！wzb_521（只对接商务 备注来意）
跟苏宁老师学泰语,43807000,3100000,广西泰好学教育咨询有限公司,我是苏宁老师 泰国人 十年泰语教学经验跨境教学：实体和网络课程灵活结合教学点：华人语言学校欢迎留言咨询报名泰语学习
卡农keno在泰国,3905000,599000,未知,生活在泰国卡农加油的拼音: kanongjiayou (请pai):一个简单的快乐男孩:少即是多
泰国铃铛大叔,2109000,410000,未知,每天更新最新的作品，希望大家喜欢没有小号萨瓦迪卡
泰国捷哥,3333000,161000,未知,两年没有更新视频了因为疫情严重所以从711开始。你的互动是我更新视频的最大动力。不定时直播。谢谢你们。
泰国泰好学,8196000,382000,未知,泰语学习els9911泰籍老师授课 发音标准纯正华人语言学校 12年泰语教学经验 每月都有泰语线上开课 0基础+日常口语+商务口语
泰国小姐姐葡萄,339000,102000,未知,大家好 我是一个爱唱歌的泰国女孩热爱喜欢文化大家有想听的泰语歌可以告诉我哟~唱给你们听~感谢大家的关注爱你们
李雷在泰国,5779000,612000,未知,我是李雷 来自湖北疫情期来泰国 感谢信任和支持从事泰国旅游地接房产百货留学情感合作请私信 最近来泰有任何问题的咨询主播星图商务: qpwt666(非本人)
周梦在泰国,3289000,258000,未知,心直口快的梦姐，老公是泰国华人，如果你来泰国有什么需要帮忙的，能帮的一定帮，骗子除外zhou0863231555
泰国林俊杰,1149,210000,未知,除了长的帅，唱歌又好听外，其他没什么优点。满2级进粉丝群
泰国大表哥和小水,2091000,432000,未知,萧邦 格拉苏蒂 雅典 宇舶 芝柏本人长期居住在泰国生活日常 ins：Deeman_Zhang 老婆Ins：dabiaoge_in_thailand
大叔在泰国,839000,279000,未知,在泰国的一枚探店大爷，记录生活，好物福利已上线
泰国大皇宫导游阿梅,1767000,357000,未知,感恩抖音平台感恩关注与支持本人只有这一个抖音号关于泰国有需要帮忙的事情请联系本人 WX：thailucky116688信息过多 回复较慢
老刘在泰国,546000,286000,未知,定居泰国多年，旅游定制和泰货喜欢收藏泰国老牌taiyuexing988
二牛泰国那些事,1183000,303000,未知,泰北二牛本是后山人偶做前堂客醉舞经阁半卷书坐井暹罗说天阔
咕噜叽啦,15786000,370000,未知,给你们安利泰国明星 泰剧
八宝一家在泰国,453000,459000,未知,扫洼地卡我和我老公带着孩子在生活身边有一群沙雕盆友们互相扶持记录着你们意想不到趣闻趣事请大家多多关注留言互动微信chubabao
曼谷阿祖qwq,1148000,534000,未知,：manguazuqwq每天分享和泰国老婆的日常阿祖：弗兰长沙人笑笑：泰国曼谷人每晚21:00不定时
吃货草帽哥,77675000,6789000,未知,好吃好玩的沙雕黑暗料理！商务：vip3368324248个人：longergeshen（备注来意）
李云龙,9688000,1027000,未知,定居泰国五年关注我带大家看泰国每天下午泰国户外直播liyunlong199108
异闻录,3841000,1344000,科普自媒体,探索远古的文明解读历史的密码
水果西施Official,2023000,506000,未知,WeChat Id: 15261885155
异闻录,3841000,1344000,科普自媒体,探索远古的文明解读历史的密码
泰有趣了叭,2480000,113000,未知,泰有趣了叭哈哈哈哈！我又回来啦！新粉老粉快上嘟嘟车粗发泰国啦
水果西施Official,2023000,506000,未知,WeChat Id: 15261885155
Nana的龙门阵,32702000,4492000,未知,我的小橱窗有惊喜哦原创内容博主，一直被抄袭，但从未被超越商务邮箱：bigfishshow@gmail.com(非本人）
金善雅,35523000,4676000,未知,商务：youliang18666（注明来意）
SpawN,32922000,1100000,未知,喜欢研究泰国文化 带你看不一样的泰国再美的视频 也无法超越亲自感受wysdzj（请备注来意）
葡萄MM,3765000,661000,未知,泰国芭提雅四方水上市场驻唱歌手
宝儿（暂退）,4174000,631000,未知,想要一份明目张胆的偏爱……
Sean的世界,2185000,1171000,未知,：sean977977977清迈旅居9年爱旅行我的频道主要分享旅居生活和旅途干货详细的长视频在今日头条首发今日头条：Sean的世界西瓜视频：Sean的世界
大局观影,10447000,837000,未知,用心讲好每一部电影谢谢你的关注流星花园更新中
和利,2676000,133000,未知,长期定居曼谷8年。三胎宝妈每晚八点直播间分享泰好物去我首页商品橱窗也能下单本人只有这一个号 不会主动加任何人请勿上当受骗
晶姐的清迈日记,472000,118000,未知,直播带货，橱窗里有好喝的咖啡！泰腐泰娱泰生活看我的视频涨知识找我请注明来意：bulangjing
GTT,52609000,413000,未知,有aump代言的同款香皂有需要的v我
曼谷小雷达(原普吉岛小雷达),4737000,616000,未知,生活在普吉粉丝群:Pujitong3美食不踩雷 出游不入坑普吉，看我就够了!没有代购，没有店铺,没有民宿
憨妹追剧,3519000,666000,未知,萨瓦迪卡！给咱们来一点很哇塞的泰剧解说呀！关注我追剧不迷路哦！
甜鱼电影,2927000,686000,未知,合作交流ν：gfh839爱电影 爱抖音推荐优质好剧️抄袭、洗稿 举报至封号！
晶姐的清迈日记,472000,118000,未知,直播带货，橱窗里有好喝的咖啡！泰腐泰娱泰生活看我的视频涨知识找我请注明来意：bulangjing
静姐海外游学,1627000,362000,未知,英国房地产管理硕士深圳房地产建筑师11年全家旅居清迈，俩娃在读国际学校分享陪读生活，组织游学，英语学习资源V：jingjie8412
毒好物,5143000,456000,未知,爱生活爱分享需要购买点击下方商品橱窗搜索
青青芷荞,8654000,603000,未知,好歌分享多谢您的关注谢谢这么好看这么优秀的你关注了我感谢抖音感谢每一位关注我的你
青青芷荞,8654000,603000,未知,好歌分享多谢您的关注谢谢这么好看这么优秀的你关注了我感谢抖音感谢每一位关注我的你
布致岛电影,13752000,1511000,未知,电影改变人生______________带给你正能量带给你好心情合作交流复制抖音号诚招优秀文案写手，丰厚
是wo吖,14389000,128000,未知,佛系剪辑胡剪乱剪禁止搬运感谢关注
渣剪_FILM,7859000,672000,未知,
TaliwPanitnan,2251000,115000,译制视频作者,泰国音乐博主只推我喜欢的音源在网抑云同名播客(可以加粉丝群聊天K歌 很好玩哟~)
泰国大苗,444000,124000,未知,写什么个人简介看内容就完了！泰国大苗就是品牌商合微dm6389888
张扬聊泰国,412000,182000,未知,在泰国曼谷开办了十年的线下泰语培训机构！这里只发教学视频，不接私教！喜欢泰国的朋友+vx：Thaiziyou55555
泰国六哥,625000,135000,未知,环游世界、去过巴基斯坦、泰国、越南、日本、老挝、土耳其、韩国、日本、欧洲等等谢谢您的关注
泰国乳胶枕，阿波,620000,336000,未知,此用户没有填写简介
阿呆,264000,105000,未知,我很简单、也很平凡、骨子里的我却很勇敢！
曼谷半個泰國仔,4239000,293000,未知,没任何业务 定居泰国 分享快乐 旅拍节目完整版都在油管
泰国克里斯คริส,1117000,127000,未知,这里有好看的泰国小哥哥
泰国筱玫,376000,172000,未知,我是泰国人筱玫（xiao mei），谢谢大家商务加微信：tao_taiyang
楠楠定居普吉岛11年,468000,107000,未知,桂林女孩 定居泰国11年 私人别墅/民宿老板娘中泰幸福家庭 混血儿子 可爱公婆超爱阳光海岛、吃海鲜、逛夜市、按摩spa民宿、攻略、生活日常，想到什么发什么
泰国苗哥,626000,123000,未知,专注国内外公寓.民宿开发分享泰国的吃喝玩乐以及文化促进！中泰物流贸易还有那些暗黑游
泰国乳胶枕工厂。阿波,543000,266000,未知,微信号：wen2467泰国曼谷原产乳胶枕头床垫生产基地。教你如何分辨，选购天然乳胶枕了解更多关于乳胶枕。
泰国苏薇&王三岁,2832000,305000,未知,她，泰国南方姑娘他，中国北方男孩记录她和他的跨国爱情故事喜怒哀乐简单平凡。
阿呆推荐,3981000,661000,未知,此用户没有填写简介
泰国小葡萄,1846000,110000,抖音音乐人,相信生活充满阳光爱生活 爱你们感谢每一位关注我的朋友们笔芯芯
泰哥,7801000,852000,未知,承蒙厚爱感恩遇见
功介哥哥（泰国版）,1399000,255000,未知,一只长居泰国的小哥每晚10:00pm直播v：helloanson1（请pai）
我是妮莎,587000,109000,未知,各种逆袭视频变妆，小技巧视频领域擅长。本人敏感大油皮，无眉大侠，欧式眼，专业护肤彩妆数十年带徒要求：想学化妆变美的有缘人想通过学习拍视频涨粉变现的有缘人学徒ns91826
泰国攻略小美姐,128000,268000,未知,定居曼谷，每天更新泰国有趣见闻（感谢支持）需要泰国好物联系客服WX：widj77666 若加满请加WX：yexiaomei3商务合作联系私人号WX：351059234
咔坤哥（泰国老板）,7032000,568000,未知,感谢陪伴，感谢有你感谢大家的关注各种商务合作Ka1188896备注招团队，热爱拍短视频V私
泰国·旅大师,2003000,169000,未知,资深泰国游产品经理致力于为粉丝们发掘呈现最鲜活最真实的“泰国社会”带你了解不一样的泰国泰国好物在橱窗
牙牙的幸福生活,2564000,265000,未知,带着宝藏女儿从哈尔滨移居到泰国的小两口分享记录我们一家的生活趣事，谢谢关注会一直乐观向上的生活！会一直继续坚持！：ls-318（星图）
辉明影视,835000,263000,未知,感谢官方感谢平台感谢支持感谢关注私信多的时候可能无法及时回复朋友们可以评论区@我，@必回
大黄蜂影视,1412000,214000,未知,泰版《流星花园》 持续更新中……泰剧《沙粒公主》 持续更新中……泰剧《旋转的爱》 已完结……喜欢追剧的同学们可进群玩耍
在曼谷的安吉酱,589000,102000,未知,曼谷民宿店主 博：在曼谷的安吉酱商务合作：hiangiehi
美少女壮士【剪辑】,1728000,206000,未知,影视剪辑，好剧推荐.原 创，日 更.️剪辑合作V7313 5073 8 加v注明来意️感谢关注，感谢官方.
小枫追剧,640000,126000,未知,感谢大家喜欢我的作品每天更新1到2集~大家的支持，就是我最大的动力
羊羊影视,1197000,212000,未知,每天分享原创精彩内容生活不易小羊叹气，希望大家多多指教！
猫猫的泰国生活,1713000,139000,未知,记录相差12岁的猫果夫妇的泰国生活感恩关注 感恩善缘粉丝找我maomao49636 (一定备注来意）
泰佛心语在泰国,2536000,195000,未知,热情开朗喜欢瞎逛的东北老妹一枚，现已定居泰国6年。如果老铁遇到情感事业不顺了，老妹虽然没法陪你整几杯，但咱能成为你情感的树洞，找我倾诉，我来帮你。带你了解不一样的泰国，吃喝玩乐私人订制不入坑、不踩雷、不套路、不乱吹任何泰国产品都可519219312喜欢的朋友帮忙点赞关注（感谢你们）萨瓦迪卡
泰国小旋风,172000,105000,未知,定居泰国普吉岛10年热爱旅游的精神小伙如果有需要咨询可以私信我感谢各位大大的支持
泰国阿卿在昆明,305000,104000,未知,在昆明二十年的泰国人开了正宗泰国菜餐厅<云瑞十八>喜欢分享泰国美食文化合作伙伴:《云嘻传媒》
魔方电影,3300000,576000,未知,一部电影一个故事
魔方电影,3300000,576000,未知,一部电影一个故事
鱼太太在泰国,658000,119000,未知,首页有9个置顶合集，自己看申请国际学校本地生活分享推荐网课资源
草莓派,1958000,377000,未知,爱追剧 解说小能手创作不易 每日1-2更禁止洗稿搬运 请尊重他人劳动成果让大家用最少的时间看最精彩的故事
阿呆,2994000,123000,未知,每个人的路都不一样，但有一样事情都不能缺就是努力，感谢好朋友们的支持与关注 V：15157866388
乐享人生在泰国,1945000,202000,未知,V:（同抖音号，长按拷贝）泰国美食、民宿、玩乐 真实视角体验与评测常住工作在泰国（泰国旅行+房纸）希望有幸能接待各位朋友，请多多关照！
泰国申哥生活好物分享,3502000,173000,未知,抖音大号：泰国阿申 工作VX shen949483042定居泰国曼谷6年，分享生活好物，分享快乐
九命影视,598000,261000,未知,最新的最全的想看的关注我一起追剧强迫症患者 私信必回要看啥剧都有一个小目标，得到各位的关注。对生活有所期待，对自己有所要求。
冷爷电影铺,2514000,551000,未知,解说有趣的综艺节目，只要你们快乐就完事了！本账号视频素材如有侵权，请联系删除！谢谢！
江苏人阿昊在泰国,1082000,113000,未知,带你了解泰国吃喝玩乐、风土人情，交流泰pai文化直播小号:在泰国的江苏人阿昊(taiguoahao)每天上午9点半分享泰pai文化，泰国户外江苏常州人定居泰国清迈，老婆是泰国人。辞去汽车工程师工作来泰国创业开民宿，现在和老婆经营网红火山排骨泰餐店，另泰国定制游地陪。感谢大家的关注和喜欢。:pjh930917(备注来意)过去无可挽回，未来可以改变 路还长，美好的事情一定会发生
阿芸说,5800000,590000,未知,阿芸带你走进芸芸众生的百态人生合作：zhaobo0608（注明来意）
带泰国人吃北京,129000,237000,未知,带着泰国友人逛吃北京城S哥是泰国大厨，敏敏也是泰国人，还有一个地道北京小伙儿泰国人喜爱的美食都在橱窗里商务合作：（备注合作品牌和来意）不备注不加，感谢加粉丝群，直播福利早知道
泰小磊在泰国曼谷,456000,131000,未知,此用户没有填写简介
索埃塔鹏,458000,112000,泰国泰拳、自由搏击运动员,索埃塔鹏，泰国。年龄29岁，身高184CM，体重73公斤，战绩，200战169胜31次KO对手。曾获WPMF泰拳70kg洲际冠军，2015利剑争锋KO张金帅 2016江海英雄打败 武僧 一豹 2019深圳卫视勇士的荣耀4连胜 2019 江苏卫视昆仑决2连胜
星罗说剧,711000,122000,未知,一个讲榴莲国故事的人
廖老幺索斐泰国乳胶源头工厂,123000,177000,未知,此用户没有填写简介
萨瓦迪卡～夏夏,2487000,141000,萨瓦迪卡百货官方账号,每日分享泰国异域风情，推荐泰国好物我是夏夏，一名不甘平庸的普通重庆女孩28岁国企离职，泰国创业已7年很开心能认识你们
Aom李海娜,880000,126000,泰国演员,泰国演员、歌手，主演泰版《浪漫满屋》《一吻定情》《yes or no》《怨灵2》泰版《杉杉来了》。
泰旅局北京办,1263000,115000,泰国国家旅游局北京办事处官方账号,泰国国家旅游局北京办事处官方账号每天为您带来有品有质的#神奇泰国官方VX平台: TAT-BJ官方WB：泰旅局北京办事处
豌豆教练潜水记,5128000,350000,AIDA自由潜水大师级教练 泰国查龙杯泰拳冠军,训练零基础小白到教练的潜水训练营自由潜教练训练官潜水旅拍私人定制行程潜水课程行程wonderdive商务合作daochengchuan
