马来西亚大黑哥,12730000,510000,未知,定居成都 商务ayy948162016.9.16马来西亚潜水相遇2018.6.22成都领证结婚小号（马来西亚大黑哥健身日常）
马来堂哥,12377000,1033000,马来堂哥官方账号,马来西亚本地华人兄弟带你了解真实的风土人情提供优质的当地资源 马来西亚不累不累！
yihuik苡慧,27664000,2289000,抖音音乐人,ins：yihuik_微博：yihui苡慧网易云：苡慧商务v：hz-flow16 或 flow16-合作邮箱：syf@flowsixteen.cn
驻马殿（中国驻马来西亚使馆）,480000,118000,中国驻马来西亚大使馆官方抖音号,有点皮的使馆，有点暖的外交。邀您关注马来西亚中马关系中国外交有奖长期征稿（文章/视频/照片）中国人的大马故事和大马朋友的中国故事，投稿请发至：myembassy2020@gmail.com使馆咨询电话：中国公民领事保护：006-03-21645301（专线）领保邮箱：lingbaokl@gmail.com中国公民护照、旅行证：006-03-21645250/21645272
是金儿啊,8754000,1097000,未知,戴金儿instagram: jinertayYouTube: Jiner Tay
老周扯谈,5085000,600000,未知,斯坦福大学硕士马来西亚华人企业CEO老周只讲真话，得罪你....我不抱歉粉丝+V: laozhouchetan001
嘟姐与嘟嘟,2712000,168000,未知,马来西亚嘟嘟柯尔鸭的FB page/Ins：callduckdudu嘟嘟柯尔鸭主人的Ins：lxiingru*马来西亚*买鸭子Ins/wx：izaac_goh希望可爱的嘟嘟可以让大家的内心感到疗愈 谢谢大家的喜欢鸭.嘟嘟不卖
东博社,572000,410000,《中国—东盟博览》杂志官方账号,打开东盟新视界
跑酷马来星,24740000,2165000,优质极限运动领域创作者,商务v：15677771553(来意请备注 否则不通过！星图合作)
